{
  "$schema": "https://json-schema.org/draft/2020-12/schema",
  "$id": "https://minekin.local/schemas/case-manifest.v1.json",
  "title": "Minekin P0 case manifest v1",
  "type": "object",
  "additionalProperties": false,
  "required": ["schema_version", "case_id", "work_package", "mandatory", "inputs", "assertions"],
  "properties": {
    "schema_version": {"const": 1},
    "case_id": {"type": "string", "pattern": "^[A-Z][A-Z0-9-]+-[0-9]{3}$"},
    "work_package": {"type": "string", "pattern": "^W[0-9]{2}$"},
    "mandatory": {"type": "boolean"},
    "inputs": {"type": "array", "items": {"type": "string"}, "uniqueItems": true},
    "input_digests": {
      "type": "object",
      "propertyNames": {"minLength": 1},
      "additionalProperties": {"type": "string", "pattern": "^[0-9a-f]{64}$"}
    },
    "assertions": {"type": "array", "minItems": 1, "items": {"type": "string"}, "uniqueItems": true},
    "oracle_inputs": {"type": "array", "items": {"type": "string"}, "uniqueItems": true}
  }
}
