{
  "schema_version": 1,
  "case_id": "CORE-090",
  "work_package": "W70",
  "mandatory": false,
  "inputs": [
    "tests/fixtures/runtime-input/bundle-p0-core-1.21.4.json",
    "tests/fixtures/runtime-input/controlled-offline-server.json"
  ],
  "assertions": [
    "first_snapshot_admitted",
    "the_server_saw_the_kin_arrive_and_never_move",
    "the_previous_run_left_the_kin_holding_input",
    "the_restart_runs_as_a_new_session",
    "the_restart_reconciled_before_it_started"
  ]
}
